"﻿""Key""",Item Type,Publication Year,Author,Title,Publication Title,ISBN,ISSN,DOI,Url,Abstract Note,Date,Date Added,Date Modified,Access Date,Pages,Num Pages,Issue,Volume,Number Of Volumes,Journal Abbreviation,Short Title,Series,Series Number,Series Text,Series Title,Publisher,Place,Language,Rights,Type,Archive,Archive Location,Library Catalog,Call Number,Extra,Notes,File Attachments,Link Attachments,Manual Tags,Automatic Tags,Editor,Series Editor,Translator,Contributor,Attorney Agent,Book Author,Cast Member,Commenter,Composer,Cosponsor,Counsel,Interviewer,Producer,Recipient,Reviewed Author,Scriptwriter,Words By,Guest,Number,Edition,Running Time,Scale,Medium,Artwork Size,Filing Date,Application Number,Assignee,Issuing Authority,Country,Meeting Name,Conference Name,Court,References,Reporter,Legal Status,Priority Numbers,Programming Language,Version,System,Code,Code Number,Section,Session,Committee,History,Legislative Body,SemanticScholarCitations,CrossRefCitations,Marker
5XNCS2HL,document,,,,,,,,https://www.its.bldrdoc.gov/publications/,,,2022-11-01 05:24:48,2022-11-01 05:24:48,,,,,,,,,,,,,,,,,,,,,,Citation Key: unknowo-u,,,,,,,,,,,,,,,,,,,,,,,,,,,,,,,,,,,,,,,,,,,,,,,,,,,,No Citations Found,No Citations Found,[149]
DXYSEPST,journalArticle,2012,"Ingram, W.",The influence of subjects and environment on audiovisual subjective tests: An international study,IEEE Journal of Selected Topics in Signal Processing,,,,,,2012-10,2022-11-01 05:24:48,2022-11-01 05:25:31,,640–651,,6,6,,,,,,,,,,,,,,,,,Citation Key: ingram2012a,,,,,⛔ No DOI found,,,,,,,,,,,,,,,,,,,,,,,,,,,,,,,,,,,,,,,,,,,,,,,No Citations Found,No Citations Found,[150]
S5GW9WGH,document,,,Journal of selected topics in signal processing,,,,,,,,2022-11-01 05:24:49,2022-11-01 05:24:49,,,,,,,,,,,,,,,,,,,,,,Citation Key: unknowo-v DOI: 10.1109/JSTSP.2012.2215306,,,,,,,,,,,,,,,,,,,,,,,,,,,,,,,,,,,,,,,,,,,,,,,,,,,,No Citations Found,No Citations Found,[151]
QYDFKHRL,document,,"Pinson, M.H.; Wolf, S.",,,,,,,,,2022-11-01 05:24:49,2022-11-01 05:24:49,,,,,,,,,,,,,,,,,,,,,,Citation Key: pinson-a,,,,,,,,,,,,,,,,,,,,,,,,,,,,,,,,,,,,,,,,,,,,,,,,,,,,No Citations Found,No Citations Found,[152]
ARRH4NH6,bookSection,,,,Comparing subjective video quality in visual communications and image processing 2003,,,,,,,2022-11-01 05:24:49,2022-11-01 05:24:49,,573–582,,,5150,,,,,,,,SPIE,,,,,,,,,Citation Key: unknowo-w,,,,,,,,,,,,,,,,,,,,,,,,,,,,,,,,,,,,,,,,,,,,,,,,,,,,No Citations Found,No Citations Found,[153]
2K3XI7C6,document,,,,,,,,https://www.spiedigitallibrary.org/conference-proceedings,,,2022-11-01 05:24:49,2022-11-01 05:24:49,,,,,,,,,,,,,,,,,,,,,,Citation Key: unknowo-x,,,,,,,,,,,,,,,,,,,,,,,,,,,,,,,,,,,,,,,,,,,,,,,,,,,,No Citations Found,No Citations Found,[154]
GXUYUFFX,document,,,,,,,,,,,2022-11-01 05:24:49,2022-11-01 05:24:49,,,,,,,,,,,,,,,,,,,,,,Citation Key: unknowo-y DOI: 10.1117/12.509908 tex.citation-number: -methodologies/10.1117/12.509908.full,,,,,,,,,,,,,,,,,,,,,,,,,,,,,,,,,,,,,,,,,,,,,,,,,,,,No Citations Found,No Citations Found,[155]
GYHUI6ZI,document,2020,"Prajwal, K.R.; Mukhopadhyay, R.; Namboodiri, V.; Jawahar, C.V.",A lip sync expert is all you need for speech to lip generation in the wild,,,,,,,2020-10,2022-11-01 05:24:49,2022-11-01 05:24:49,,,,,,,,,,,,,,,,,,,,,,Citation Key: prajwal2020a,,,,,,,,,,,,,,,,,,,,,,,,,,,,,,,,,,,,,,,,,,,,,,,,,,,,No Citations Found,No Citations Found,[156]
HYDFYTPE,conferencePaper,,,,ACM international conference on multimedia (ACM MM,,,,https://researchportal.bath.ac.uk/en/publications/a-lip,,,2022-11-01 05:24:49,2022-11-01 05:25:36,,,,,,,,,,,,,,,,,,,,,,Citation Key: unknowo-z,,,,,⛔ No DOI found,,,,,,,,,,,,,,,,,,,,,,,,,,,,,,,,,,,,,,,,,,,,,,,No Citations Found,No Citations Found,[157]
ZGSZGDXE,document,,,-sync-expert-is-all-you-need-for-speech-to-lip-generation-in (Publisher: Association for Computing Machinery,,,,,,,,2022-11-01 05:24:49,2022-11-01 05:24:49,,,,,,,,,,,,,,,,,,,,,,Citation Key: unknowp-a DOI: 10.1145/3394171.3413532,,,,,,,,,,,,,,,,,,,,,,,,,,,,,,,,,,,,,,,,,,,,,,,,,,,,No Citations Found,No Citations Found,[158]
ZEM2BPZ5,journalArticle,2020,"Raffi, F.",The impact of italian dubbing on viewers’ immersive experience: An audience reception study,Online Journal of Communication and Media Technologies,,,10/gq5xb7,https://www.ojcmt.net/,,2020-06,2022-11-01 05:24:49,2022-11-01 05:25:37,,202019,,3,10,,,,,,,,,,,,,,,,,0 citations (Crossref) [2022-11-01] Citation Key: raffi2020a,,,,,⚠️ Invalid DOI,,,,,,,,,,,,,,,,,,,,,,,,,,,,,,,,,,,,,,,,,,,,,,,No Citations Found,0,[159]
TIB6RZTJ,document,,,,,,,,,,,2022-11-01 05:24:49,2022-11-01 05:24:49,,,,,,,,,,,,,,,,,,,,,,Citation Key: unknowp-b DOI: 10.30935/ojcmt/8371,,,,,,,,,,,,,,,,,,,,,,,,,,,,,,,,,,,,,,,,,,,,,,,,,,,,No Citations Found,No Citations Found,[160]
7U7V7PUL,bookSection,2015,"Rainer, B.; Petscharnig, S.; Timmerer, C.; Hellwagner, H.",Is one second enough? Evaluating QoE for inter-destination multimedia synchronization using human computation and crowdsourcing,2015 seventh international workshop on quality of multimedia experience (QoMEX,,,,http://ieeexplore.ieee.org/document/,,2015-05,2022-11-01 05:24:49,2022-11-01 05:24:49,,1–6,,,,,,,,,,,IEEE,Pylos-Nestoras,,,,,,,,Citation Key: rainer2015a,,,,,,,,,,,,,,,,,,,,,,,,,,,,,,,,,,,,,,,,,,,,,,,,,,,,No Citations Found,No Citations Found,[161]
PNBKEM8P,document,,,,,,,,,,,2022-11-01 05:24:49,2022-11-01 05:24:49,,,,,,,,,,,,,,,,,,,,,,Citation Key: unknowp-c DOI: 10.1109/QoMEX.2015.7148107 tex.citation-number: 7148107/,,,,,,,,,,,,,,,,,,,,,,,,,,,,,,,,,,,,,,,,,,,,,,,,,,,,No Citations Found,No Citations Found,[162]
CKFYSJCY,journalArticle,2015,"Ramos, M.",The emotional experience of films: Does audio description make a difference?,The Translator,,,10.1080/13556509.2014.994853),,,2015,2022-11-01 05:24:49,2022-11-01 05:24:56,,68–94,,1,21,,,,,,,,,,,,,,,,,Citation Key: ramos2015a,,,,,⚠️ Invalid DOI,,,,,,,,,,,,,,,,,,,,,,,,,,,,,,,,,,,,,,,,,,,,,,,No Citations Found,No Citations Found,[163]
22MASNCI,journalArticle,2016,"Ramos, M.",Testing audio narration: The emotional impact of language in audio description,Perspectives (Gerontological Nursing Association (Canada)),,,10.1080/0907676X.2015.1120760),,,2016,2022-11-01 05:24:49,2022-11-01 05:24:56,,606–634,,4,24,,Perspectives,,,,,,,,,,,,,,,Citation Key: ramos2016a,,,,,⚠️ Invalid DOI,,,,,,,,,,,,,,,,,,,,,,,,,,,,,,,,,,,,,,,,,,,,,,,No Citations Found,No Citations Found,[164]
GYT7IGAP,journalArticle,2014,"Ramos, M.; Rojo, A.","feeling"" audio description: Exploring the impact of ad on emotional response",Translation Spaces,,,10.1075/ts.3.06ram),,,2014,2022-11-01 05:24:49,2022-11-01 05:24:56,,133–150,,,3,,,,,,,,,,,,,,,,,Citation Key: ramos2014a,,,,,⚠️ Invalid DOI,,,,,,,,,,,,,,,,,,,,,,,,,,,,,,,,,,,,,,,,,,,,,,,No Citations Found,No Citations Found,[165]
8KJN2I7V,book,2019,"Ranzato, I.; Zanotti, S.",Reassessing dubbing: Historical approaches and current trends. John benjamins publishing company,,,,,,,2019,2022-11-01 05:24:49,2022-11-01 05:24:49,,,,,,,,,,,,,<sub>L</sub>GoDwAAQBAJ,Google-Books-ID,,,,,,,,Citation Key: ranzato2019a,,,,,,,,,,,,,,,,,,,,,,,,,,,,,,,,,,,,,,,,,,,,,,,,,,,,No Citations Found,No Citations Found,[166]
96PFYVKU,document,2011,"Reiter, U.",Quality of experience: a buzzword or the key to successful multimedia delivery across networks?,,,,,,,2011-10,2022-11-01 05:24:49,2022-11-01 05:24:49,,,,,,,,,,,,,,,,,,,,,,Citation Key: reiter2011a,,,,,,,,,,,,,,,,,,,,,,,,,,,,,,,,,,,,,,,,,,,,,,,,,,,,No Citations Found,No Citations Found,[167]
3WYZYHAN,conferencePaper,,,,Proceedings of the 6th latin america networking conference,,,,,,,2022-11-01 05:24:49,2022-11-01 05:25:36,,20–24,,,,,,,,,,,Association for Computing,"New York, NY, USA",,,,,,,,Citation Key: unknowp-d,,,,,⛔ No DOI found,,,,,,,,,,,,,,,,,,,,,,,,,,,,,,,,,,,,,,,,,,,,,,,No Citations Found,No Citations Found,[168]
V8GVBSLX,document,,Machinery,,,,,,https://doi.org/10.1145/2078216,,,2022-11-01 05:24:49,2022-11-01 05:24:49,,,,,,,,,,,,,,,,,,,,,,Citation Key: machinery-a DOI: 10.1145/2078216,,,,,,,,,,,,,,,,,,,,,,,,,,,,,,,,,,,,,,,,,,,,,,,,,,,,No Citations Found,No Citations Found,[169]
WIIWHNY7,document,,,,,,,,,,,2022-11-01 05:24:49,2022-11-01 05:24:49,,,,,,,,,,,,,,,,,,,,,,Citation Key: unknowp-e DOI: 10.1145/2078216.2078220 tex.citation-number: 2078220,,,,,,,,,,,,,,,,,,,,,,,,,,,,,,,,,,,,,,,,,,,,,,,,,,,,No Citations Found,No Citations Found,[170]
NNGWC6BM,document,2015,"Reyes Lozano, J.d l",La traduction du cinéma pour les enfants: Une étude sur la réception [the translation of cinema for children: A reception-oriented study,,,,,,,2015,2022-11-01 05:24:49,2022-11-01 05:24:49,,,,,,,,,,,,,,,,,,,,,,Citation Key: reyes2015a,,,,,,,,,,,,,,,,,,,,,,,,,,,,,,,,,,,,,,,,,,,,,,,,,,,,No Citations Found,No Citations Found,[171]
PZY55GNK,book,2020,"Riniolo, T.C.; Capuana, L.J.",Directly comparing subtitling and dubbing using Netflix: Examining enjoyment issues in the natural setting,,,,,,,2020-07,2022-11-01 05:24:49,2022-11-01 05:24:49,,,,,,,,,,,,,Current Psychology,,,,,,,,,Citation Key: riniolo2020a,,,,,,,,,,,,,,,,,,,,,,,,,,,,,,,,,,,,,,,,,,,,,,,,,,,,No Citations Found,No Citations Found,[172]
CRIP3X9P,document,,,,,,,,https://doi.org/10.1007/s12144-020-00948,,,2022-11-01 05:24:49,2022-11-01 05:24:49,,,,,,,,,,,,,,,,,,,,,,Citation Key: unknowp-f DOI: 10.1007/s12144-020-00948,,,,,,,,,,,,,,,,,,,,,,,,,,,,,,,,,,,,,,,,,,,,,,,,,,,,No Citations Found,No Citations Found,[173]
AQ8US6MU,document,,,,,,,,,,,2022-11-01 05:24:49,2022-11-01 05:24:49,,,,,,,,,,,,,,,,,,,,,,Citation Key: unknowp-g DOI: 10.1007/s12144-020-00948-1 tex.citation-number: -1,,,,,,,,,,,,,,,,,,,,,,,,,,,,,,,,,,,,,,,,,,,,,,,,,,,,No Citations Found,No Citations Found,[174]
2XPWCP6B,journalArticle,2013,"Romero-Fresco, P.","Accessible filmmaking: Joining the dots between audiovisual translation, accessibility and filmmaking",The Journal of Specialised Translation,,,,,,2013-01,2022-11-01 05:24:49,2022-11-01 05:25:35,,,,,201–223,,,,,,,,,,,,,,,,,Citation Key: romero-fresco2013a,,,,,⛔ No DOI found,,,,,,,,,,,,,,,,,,,,,,,,,,,,,,,,,,,,,,,,,,,,,,,No Citations Found,No Citations Found,[175]
NL6456JR,document,2016,"Romero-Fresco, P.",The reception of subtitles for the deaf and hard of hearing in,,,,,,,2016,2022-11-01 05:24:49,2022-11-01 05:24:49,,,,,,,,,,,,,,,,,,,,,,Citation Key: romero-fresco2016a,,,,,,,,,,,,,,,,,,,,,,,,,,,,,,,,,,,,,,,,,,,,,,,,,,,,No Citations Found,No Citations Found,[176]
5VUM2V44,journalArticle,2018,"Romero-Fresco, P.",In support of a wide notion of media accessibility: Access to content and access to creation,Journal of Audiovisual Translation,,,10/gq5xcb,http://jatjournal.org/index.php/,,2018-11,2022-11-01 05:24:49,2022-11-01 05:25:48,,187–204,,1,1,,,,,,,,,,,,,,,,,7 citations (Crossref) [2022-11-01] Citation Key: romero-fresco2018a,,,,,⚠️ Invalid DOI,,,,,,,,,,,,,,,,,,,,,,,,,,,,,,,,,,,,,,,,,,,,,,,No Citations Found,7,[177]
XX364X9K,document,,,,,,,,,,,2022-11-01 05:24:49,2022-11-01 05:24:49,,,,,,,,,,,,,,,,,,,,,,Citation Key: unknowp-h DOI: 10.47476/jat.v1i1.53 Volume: jat/article/view/53 (Number: 1,,,,,,,,,,,,,,,,,,,,,,,,,,,,,,,,,,,,,,,,,,,,,,,,,,,,No Citations Found,No Citations Found,[178]
4I5SPPLA,journalArticle,2019,"Romero-Fresco, P.",The dubbing effect: An eye-tracking study on how viewers make dubbing work,The Journal of Specialised Translation,,,,,,2019-05,2022-11-01 05:24:49,2022-11-01 05:25:31,,,,,,,,,,,,,,,,,,,,,,Citation Key: romero-fresco2019a,,,,,⛔ No DOI found,,,,,,,,,,,,,,,,,,,,,,,,,,,,,,,,,,,,,,,,,,,,,,,No Citations Found,No Citations Found,[179]
CZIULRDZ,document,2019,"Saboo, A.; Baumann, T.",Integration of dubbing constraints into machine,,,,,,,2019,2022-11-01 05:24:49,2022-11-01 05:24:49,,,,,,,,,,,,,,,,,,,,,,Citation Key: saboo2019a,,,,,,,,,,,,,,,,,,,,,,,,,,,,,,,,,,,,,,,,,,,,,,,,,,,,No Citations Found,No Citations Found,[180]
7VRFVY7G,conferencePaper,,,Translation,Proceedings of the fourth conference on machine translation (volume,,,,,,,2022-11-01 05:24:49,2022-11-01 05:25:31,,,,,,,,,,,,,,,,,,,,,,Citation Key: unknowp-i,,,,,⛔ No DOI found,,,,,,,,,,,,,,,,,,,,,,,,,,,,,,,,,,,,,,,,,,,,,,,No Citations Found,No Citations Found,[181]
A7GCHCSV,book,,,Research papers,,,,,,,,2022-11-01 05:24:49,2022-11-01 05:24:49,,,,,,,,,,,,,Association for Computational,"Florence, Italy",,,,,,,,Citation Key: unknowp-j Pages: 94–101 tex.citation-number: 1:,,,,,,,,,,,,,,,,,,,,,,,,,,,,,,,,,,,,,,,,,,,,,,,,,,,,No Citations Found,No Citations Found,[182]
7FMZL4W2,document,,,,,,,,,,,2022-11-01 05:24:49,2022-11-01 05:24:49,,,,,,,,,,,,,,,,,,,,,,Citation Key: unknowp-k DOI: 10.18653/v1/W19-5210 tex.citation-number: W19-5210,,,,,,,,,,,,,,,,,,,,,,,,,,,,,,,,,,,,,,,,,,,,,,,,,,,,No Citations Found,No Citations Found,[183]
QPUCZTXC,document,2022,"Saha, D.; Nayak, S.; Baumann, T.",Merkel podcast corpus: A multimodal dataset compiled from 16 years of angela merkel’s weekly video podcasts,,,,,,,2022,2022-11-01 05:24:49,2022-11-01 05:24:49,,,,,,,,,,,,,,,,,,,,,,Citation Key: saha2022a Type: (LREC paper.),,,,,,,,,,,,,,,,,,,,,,,,,,,,,,,,,,,,,,,,,,,,,,,,,,,,No Citations Found,No Citations Found,[184]
IH5DHLBD,bookSection,2020,"Sánchez-Mompeán, S.",Dubbing and prosody at the interface,The prosody of dubbed speech,,,,,,2020-01,2022-11-01 05:24:49,2022-11-01 05:24:49,,19–88,,,,,,,,,,,,,,,,,,,,Citation Key: s2020a DOI: 10.1007/978-3-030-35521-0_2,,,,,,,,,,,,,,,,,,,,,,,,,,,,,,,,,,,,,,,,,,,,,,,,,,,,No Citations Found,No Citations Found,[185]
TMABJKMN,document,,"Sánchez-Mompeán, S.",,,,,,,,,2022-11-01 05:24:49,2022-11-01 05:24:49,,,,,,,,,,,,,,,,,,,,,,Citation Key: s-a,,,,,,,,,,,,,,,,,,,,,,,,,,,,,,,,,,,,,,,,,,,,,,,,,,,,No Citations Found,No Citations Found,[186]
6N393PRP,document,2021,,,,,,,,,2021-09,2022-11-01 05:24:49,2022-11-01 05:24:49,,,,,,,,,,,,,,,,,,,,,,Citation Key: unknown2021b,,,,,,,,,,,,,,,,,,,,,,,,,,,,,,,,,,,,,,,,,,,,,,,,,,,,No Citations Found,No Citations Found,[187]
N3Y5WKSV,document,,,,,,,,https://www.sciencedirect.com/science/,,,2022-11-01 05:24:49,2022-11-01 05:24:49,,,,,,,,,,,,,,,,,,,,,,Citation Key: unknowp-l tex.citation-number: 190.,,,,,,,,,,,,,,,,,,,,,,,,,,,,,,,,,,,,,,,,,,,,,,,,,,,,No Citations Found,No Citations Found,[188]
VHEQJDGR,document,,,,,,,,,,,2022-11-01 05:24:49,2022-11-01 05:24:49,,,,,,,,,,,,,,,,,,,,,,Citation Key: unknowp-m DOI: 10.1016/j.langcom.2021.07.001 tex.citation-number: article/pii/S0271530921000562,,,,,,,,,,,,,,,,,,,,,,,,,,,,,,,,,,,,,,,,,,,,,,,,,,,,No Citations Found,No Citations Found,[189]
BTEKN3XD,document,2013,"Schmidt, C.; Koller, O.; Ney, H.; Hoyoux, T.; Piater, J.",Using viseme recognition to improve a sign language translation system,,,,,,,2013,2022-11-01 05:24:49,2022-11-01 05:24:49,,,,,,,,,,,,,,,,,,,,,,Citation Key: schmidt2013a,,,,,,,,,,,,,,,,,,,,,,,,,,,,,,,,,,,,,,,,,,,,,,,,,,,,No Citations Found,No Citations Found,[190]
IT8X7535,document,2010,"Seshadrinathan, K.; Soundararajan, R.; Bovik, A.; Cormack, L.",A subjective study to evaluate video quality assessment algorithms,,,,,,,2010,2022-11-01 05:24:49,2022-11-01 05:24:49,,,,,,,,,,,,,,,,,,,,,,Citation Key: seshadrinathan2010a DOI: 10.1117/12.845382,,,,,,,,,,,,,,,,,,,,,,,,,,,,,,,,,,,,,,,,,,,,,,,,,,,,No Citations Found,No Citations Found,[191]
4BYATYKC,document,2014,"Shahid, M.",Methods for objective and subjective video quality assessment and for speech recognition,,,,,http://urn.kb.se/resolve,,2014,2022-11-01 05:24:49,2022-11-01 05:24:49,,,,,,,,,,,,,"Department of Applied Signal Processing, Blekinge Institute of Technology",,,,,,,,,Citation Key: shahid2014a Place: Karlskrona,,,,,,,,,,,,,,,,,,,,,,,,,,,,,,,,,,,,,,,,,,,,,,,,,,,,No Citations Found,No Citations Found,[192]
4HI23X6Z,document,2001,"Shdaifat, I.; Grigat, R.-R.; Lütgert, S.",Viseme recognition using multiple feature matching,,,,,,,2001,2022-11-01 05:24:49,2022-11-01 05:24:49,,,,,,,,,,,,,,,,,,,,,,Citation Key: shdaifat2001a,,,,,,,,,,,,,,,,,,,,,,,,,,,,,,,,,,,,,,,,,,,,,,,,,,,,No Citations Found,No Citations Found,[193]
6BIF7KGF,bookSection,2018,"Sinno, Z.; Bovik, A.C.",Large scale subjective video quality study,In,,,,,,2018-10,2022-11-01 05:24:49,2022-11-01 05:24:49,,,,,,,,,,,,,,,,,,,,,,Citation Key: sinno2018a,,,,,,,,,,,,,,,,,,,,,,,,,,,,,,,,,,,,,,,,,,,,,,,,,,,,No Citations Found,No Citations Found,[194]
ICKSTEW7,document,,,,,,,,https://ieeexplore.ieee.org/,,,2022-11-01 05:24:49,2022-11-01 05:24:49,,,,,,,,,,,,,IEEE,,,,,,,,,Citation Key: unknowp-n Place: Athens,,,,,,,,,,,,,,,,,,,,,,,,,,,,,,,,,,,,,,,,,,,,,,,,,,,,No Citations Found,No Citations Found,[195]
LXWIVNTE,document,,,,,,,,,,,2022-11-01 05:24:49,2022-11-01 05:24:49,,,,,,,,,,,,,,,,,,,,,,Citation Key: unknowp-o DOI: 10.1109/ICIP.2018.8451467 tex.citation-number: document/8451467/,,,,,,,,,,,,,,,,,,,,,,,,,,,,,,,,,,,,,,,,,,,,,,,,,,,,No Citations Found,No Citations Found,[196]
6NB3DB3G,book,2019,"Sinno, Z.; Bovik, A.C.",February,,,,,,,2019,2022-11-01 05:24:49,2022-11-01 05:24:49,,,,,,,,,,,,,Large-Scale Study of Perceptual Video Quality,,,,,,,,,Citation Key: sinno2019a,,,,,,,,,,,,,,,,,,,,,,,,,,,,,,,,,,,,,,,,,,,,,,,,,,,,No Citations Found,No Citations Found,[197]
8GNQU6RG,journalArticle,,,,IEEE Transactions on Image Processing,,,10/gn632q,https://ieeexplore.ieee.org/document/8463581/,,,2022-11-01 05:24:49,2022-11-01 05:25:59,,612–627,,2,28,,,,,,,,,,,,,,,,,82 citations (Crossref) [2022-11-01] Citation Key: unknowp-p,,,,,,,,,,,,,,,,,,,,,,,,,,,,,,,,,,,,,,,,,,,,,,,,,,,,No Citations Found,82,[198]
QNSIN2AR,document,,,,,,,,,,,2022-11-01 05:24:49,2022-11-01 05:24:49,,,,,,,,,,,,,,,,,,,,,,Citation Key: unknowp-q DOI: 10.1109/TIP.2018.2869673,,,,,,,,,,,,,,,,,,,,,,,,,,,,,,,,,,,,,,,,,,,,,,,,,,,,No Citations Found,No Citations Found,[199]
Y54SRRD2,document,2008,"Smith, T.; Henderson, J.",Attentional synchrony in static and dynamic,,,,,,,2008-01,2022-11-01 05:24:49,2022-11-01 05:24:49,,,,,,,,,,,,,,,,,,,,,,Citation Key: smith2008a,,,,,,,,,,,,,,,,,,,,,,,,,,,,,,,,,,,,,,,,,,,,,,,,,,,,No Citations Found,No Citations Found,[200]
WS6V2TN7,journalArticle,,,Scenes,Journal of Vision,,,10/fmrg6k,,,,2022-11-01 05:24:49,2022-11-01 05:25:42,,773,,,8,,,,,,,,,,,,,,,,,20 citations (Crossref) [2022-11-01] Citation Key: unknowp-r,,,,,,,,,,,,,,,,,,,,,,,,,,,,,,,,,,,,,,,,,,,,,,,,,,,,No Citations Found,20,[201]
DS7KCPIW,journalArticle,2010,"Sokolovsky, Y.V.",On the linguistic definition of translation. undefined,Retrieved,,,,,,2010,2022-11-01 05:24:49,2022-11-01 05:25:33,,,,,,,,,,,,,,,,,,,,,,Citation Key: sokolovsky2010a,,,,,⛔ No DOI found,,,,,,,,,,,,,,,,,,,,,,,,,,,,,,,,,,,,,,,,,,,,,,,No Citations Found,No Citations Found,[202]
UNCHJTJ5,document,2022,,,,,,,https://www.semanticscholar.org/paper/,,2022-01-13,2022-11-01 05:24:49,2022-11-01 05:24:49,,,,,,,,,,,,,,,,,,,,,,Citation Key: unknown2022a Type: from,,,,,,,,,,,,,,,,,,,,,,,,,,,,,,,,,,,,,,,,,,,,,,,,,,,,No Citations Found,No Citations Found,[203]
NT9XG6M7,conferencePaper,2015,"Sotelo, R.",Subjective and objective video quality assessment. A parametric model for digital television coded with H.264,"2015 CHILEAN conference on electrical, electronics engineering, information and communication technologies",,,,,,2015-10,2022-11-01 05:24:49,2022-11-01 05:24:49,,,,,,,,,,,,,,,,,,,,,,Citation Key: sotelo2015a,,,,,,,,,,,,,,,,,,,,,,,,,,,,,,,,,,,,,,,,,,,,,,,,,,,,No Citations Found,No Citations Found,[204]
P8T8W72D,document,,,,,,,,http://ieeexplore.ieee.org/document/7400414/doi:10.1109/Chilecon,,,2022-11-01 05:24:49,2022-11-01 05:24:49,,,,,,,,,,,,,IEEE,,,,,,,,,"Citation Key: c-a Pages: 437–440 Place: Santiago, Chile",,,,,,C.H.I.L.E.C.O.N.,,,,,,,,,,,,,,,,,,,,,,,,,,,,,,,,,,,,,,,,,,,,,,No Citations Found,No Citations Found,[205]
VY8GB3Q3,document,2017,"Sotelo, R.; Joskowicz, J.; Anedda, M.; Murroni, M.; Giusto, D.D.",,,,,,,,2017-06,2022-11-01 05:24:49,2022-11-01 05:24:49,,,,,,,,,,,,,,,,,,,,,,Citation Key: sotelo2017a,,,,,,,,,,,,,,,,,,,,,,,,,,,,,,,,,,,,,,,,,,,,,,,,,,,,No Citations Found,No Citations Found,[206]
ZP577Y45,conferencePaper,,,Subjective video quality assessments for 4K UHDTV,2017 IEEE international symposium on broadband multimedia systems and broadcasting (BMSB,,,,,,,2022-11-01 05:24:49,2022-11-01 05:25:31,,1–6,,,,,,,,,,,,,,,,,,,,Citation Key: unknowp-s,,,,,⛔ No DOI found,,,,,,,,,,,,,,,,,,,,,,,,,,,,,,,,,,,,,,,,,,,,,,,No Citations Found,No Citations Found,[207]
KX3GQQEN,book,,,,,,,,,,,2022-11-01 05:24:49,2022-11-01 05:24:49,,,,,,,,,,,,,IEEE,"Cagliari, Italy",,,,,,,,Citation Key: unknowp-t DOI: 10.1109/BMSB.2017.7986225,,,,,,,,,,,,,,,,,,,,,,,,,,,,,,,,,,,,,,,,,,,,,,,,,,,,No Citations Found,No Citations Found,[208]
W3WWTNBV,bookSection,2012,"Szarkowska, A.; Jankowska, A.",Text-to-speech audio description of voiced-over films: A case study of audio described volver in polish,Emerging topics in translation: Audio description,,,,,,2012,2022-11-01 05:24:49,2022-11-01 05:24:49,,81–98,,,,,,,,,,,Università di Trieste,Trieste,,,,,,,,Citation Key: szarkowska2012a,,,,,,"Perego, E.",,,,,,,,,,,,,,,,,,,,,,,,,,,,,,,,,,,,,,,,,,,,,,No Citations Found,No Citations Found,[209]
TTCWKC3B,document,2016,"Szarkowska, A.; Krejtz, I.; Pilipczuk, O.; Dutka, Å.; Kruger, J.-L.","The effects of text editing and subtitle presentation rate on the comprehension and reading patterns of interlingual and intralingual subtitles among deaf, hard of hearing and hearing viewers",,,,,,,2016,2022-11-01 05:24:49,2022-11-01 05:24:49,,,,,,,,,,,,,,,,,,,,,,Citation Key: szarkowska2016a,,,,,,,,,,,,,,,,,,,,,,,,,,,,,,,,,,,,,,,,,,,,,,,,,,,,No Citations Found,No Citations Found,[210]
DLYEEGQX,document,2015,"Szarkowska, A.; Laskowska, M.",Poland - a voice-over country no more?,,,,,,,2015,2022-11-01 05:24:49,2022-11-01 05:24:49,,,,,,,,,,,,,,,,,,,,,,Citation Key: szarkowska2015a,,,,,,,,,,,,,,,,,,,,,,,,,,,,,,,,,,,,,,,,,,,,,,,,,,,,No Citations Found,No Citations Found,[211]
ZZ5A84UW,bookSection,,,a report on an online survey on subtitling preferences among polish hearing and hearing-impaired viewers,Accessing audiovisual translation,,,,,,,2022-11-01 05:24:49,2022-11-01 05:24:49,,179–197,,,,,,,,,,,Peter Lang,Frankfurt,,,,,,,,Citation Key: bogucki-a,,,,,,"Bogucki, Ł.; Deckert, M.",,,,,,,,,,,,,,,,,,,,,,,,,,,,,,,,,,,,,,,,,,,,,,No Citations Found,No Citations Found,[212]
ZNIEKCSF,bookSection,2020,"Topiwala, P.; Dai, W.; Pian, J.",Deep learning and video quality analysis: towards a unified VQA,Applications of digital image processing XLIII,,,,,,2020-09,2022-11-01 05:24:49,2022-11-01 05:24:49,,,,,,,,,,,,,,,,,,,,,,Citation Key: topiwala2020a,,,,,,,,,,,,,,,,,,,,,,,,,,,,,,,,,,,,,,,,,,,,,,,,,,,,No Citations Found,No Citations Found,[213]
27LMFA6K,document,,,,,,,,,,,2022-11-01 05:24:49,2022-11-01 05:24:49,,,,,,,,,,,,,International Society for Optics and Photonics,,,,,,,,,Citation Key: unknowp-u Pages: 115100 Volume: 11510,,,,,,,,,,,,,,,,,,,,,,,,,,,,,,,,,,,,,,,,,,,,,,,,,,,,No Citations Found,No Citations Found,[214]
K76XGM3Q,document,2021,,,,,,,https://www.spiedigitallibrary.org/conference,,2021-01-29,2022-11-01 05:24:49,2022-11-01 05:24:49,,,,,,,,,,,,,,,,,,,,,,Citation Key: unknown2021c Type: from,,,,,,,,,,,,,,,,,,,,,,,,,,,,,,,,,,,,,,,,,,,,,,,,,,,,No Citations Found,No Citations Found,[215]
A6NLQF46,document,,,,,,,,,,,2022-11-01 05:24:49,2022-11-01 05:24:49,,,,,,,,,,,,,,,,,,,,,,Citation Key: unknowp-v tex.citation-number: -proceedings-of-spie/11510/115100V/Deep-learning-and-video,,,,,,,,,,,,,,,,,,,,,,,,,,,,,,,,,,,,,,,,,,,,,,,,,,,,No Citations Found,No Citations Found,[216]
V6SYCY9P,document,,,,,,,,,,,2022-11-01 05:24:49,2022-11-01 05:24:49,,,,,,,,,,,,,,,,,,,,,,Citation Key: unknowp-w DOI: 10.1117/12.2571309 tex.citation-number: -quality-analysis–towards-a-unified/10.1117/12.2571309.short,,,,,,,,,,,,,,,,,,,,,,,,,,,,,,,,,,,,,,,,,,,,,,,,,,,,No Citations Found,No Citations Found,[217]
6SQV33K4,thesis,2012,"Tuominen, T.",The art of accidental reading and incidental listening: An empirical study on the viewing of subtitled films,,,,,,,2012,2022-11-01 05:24:49,2022-11-01 05:24:49,,,,,,,,,,,,,University of Tampere,"Tampere, Finland",,,,,,,,Citation Key: tuominen2012a,,,,,,,,,,,,,,,,,,,,,,,,,,,,,,,,,,,,,,,,,,,,,,,,,,,,No Citations Found,No Citations Found,[218]
REYCGAEE,journalArticle,2007,"Varela, F.C.",Quality standards in dubbing: a proposal,Tradterm,,,,,,2007-12,2022-11-01 05:24:49,2022-11-01 05:25:33,,,,,,,,,,,,,,,,,,,,,,Citation Key: varela2007a,,,,,⛔ No DOI found,,,,,,,,,,,,,,,,,,,,,,,,,,,,,,,,,,,,,,,,,,,,,,,No Citations Found,No Citations Found,[219]
7BNG4D53,document,,,71,,,,,http://www.revistas.usp.br/tradterm/,,,2022-11-01 05:24:49,2022-11-01 05:24:49,,,,,,,,,,,,,,,,,,,,,,Citation Key: unknowp-x,,,,,,,,,,,,,,,,,,,,,,,,,,,,,,,,,,,,,,,,,,,,,,,,,,,,No Citations Found,No Citations Found,[220]
VA448FID,document,,,,,,,,,,,2022-11-01 05:24:49,2022-11-01 05:24:49,,,,,,,,,,,,,,,,,,,,,,Citation Key: unknowp-y DOI: 10.11606/issn.2317-9511.tradterm.2007.47466 tex.citation-number: article/view/47466,,,,,,,,,,,,,,,,,,,,,,,,,,,,,,,,,,,,,,,,,,,,,,,,,,,,No Citations Found,No Citations Found,[221]
I3VN4CLM,journalArticle,1977,"Vöge, H.",The translation of films: Sub-titling versus dubbing,Babel,,,10.1075/babel.23.3.05vog),https://doi.org/10.1075/babel.23.3.05vog),,1977,2022-11-01 05:24:50,2022-11-01 05:24:56,,120–125,,3,23,,,,,,,,,,,,,,,,,Citation Key: voege1977a,,,,,⚠️ Invalid DOI,,,,,,,,,,,,,,,,,,,,,,,,,,,,,,,,,,,,,,,,,,,,,,,No Citations Found,No Citations Found,[222]
J57B5ZX3,document,2015,"Völker, C.; Bisitz, T.; Huber, R.; Ernst, S.",Adaptions for the MUlti Stimulus test with Hidden Reference and Anchor (MUSHRA) for elder and technical unexperienced participants,,,,,,,2015,2022-11-01 05:24:50,2022-11-01 05:24:50,,,,,,,,,,,,,,,,,,,,,,Citation Key: voelker2015a,,,,,,,,,,,,,,,,,,,,,,,,,,,,,,,,,,,,,,,,,,,,,,,,,,,,No Citations Found,No Citations Found,[223]
