"﻿""Key""",Item Type,Publication Year,Author,Title,Publication Title,ISBN,ISSN,DOI,Url,Abstract Note,Date,Date Added,Date Modified,Access Date,Pages,Num Pages,Issue,Volume,Number Of Volumes,Journal Abbreviation,Short Title,Series,Series Number,Series Text,Series Title,Publisher,Place,Language,Rights,Type,Archive,Archive Location,Library Catalog,Call Number,Extra,Notes,File Attachments,Link Attachments,Manual Tags,Automatic Tags,Editor,Series Editor,Translator,Contributor,Attorney Agent,Book Author,Cast Member,Commenter,Composer,Cosponsor,Counsel,Interviewer,Producer,Recipient,Reviewed Author,Scriptwriter,Words By,Guest,Number,Edition,Running Time,Scale,Medium,Artwork Size,Filing Date,Application Number,Assignee,Issuing Authority,Country,Meeting Name,Conference Name,Court,References,Reporter,Legal Status,Priority Numbers,Programming Language,Version,System,Code,Code Number,Section,Session,Committee,History,Legislative Body,SemanticScholarCitations,CrossRefCitations,Marker
RH286S8B,document,2018,,Modifications of the MUlti stimulus test with Hidden Reference and Anchor (MUSHRA) for use in audiology,,,,,,,2018,2022-11-01 05:24:50,2022-11-01 05:24:50,,,,,,,,,,,,,,,,,,,,,,Citation Key: unknown2018b,,,,,,,,,,,,,,,,,,,,,,,,,,,,,,,,,,,,,,,,,,,,,,,,,,,,No Citations Found,No Citations Found,[224]
2C2MY43A,journalArticle,,,,International Journal of Audiology,,,,https://doi.org/10.1080/,,,2022-11-01 05:24:50,2022-11-01 05:25:35,,92– 104,,,sup3,,,,,,,,,,,,,,,,,Citation Key: unknowp-z,,,,,⛔ No DOI found,,,,,,,,,,,,,,,,,,,,,,,,,,,,,,,,,,,,,,,,,,,,,,,No Citations Found,No Citations Found,[225]
HPAJ7XPW,document,,,,,,,,eprint:,,,2022-11-01 05:24:50,2022-11-01 05:24:50,,,,,,,,,,,,,,,,,,,,,,Citation Key: unknowq-a DOI: 10.1080/14992027.2016.1220680)doi:10.1080/14992027,,,,,,,,,,,,,,,,,,,,,,,,,,,,,,,,,,,,,,,,,,,,,,,,,,,,No Citations Found,No Citations Found,[226]
24I8LEPZ,book,1992,"Whitman-Linsen, C.",Through the dubbing glass,,,,,,,1992,2022-11-01 05:24:50,2022-11-01 05:24:50,,,,,,,,,,,,,Peter Lang,Frankfurt,,,,,,,,Citation Key: whitman-linsen1992a,,,,,,,,,,,,,,,,,,,,,,,,,,,,,,,,,,,,,,,,,,,,,,,,,,,,No Citations Found,No Citations Found,[227]
EA2WZPIS,journalArticle,2014,"Wickham, H.",Tidy data,The American Statistician,,,10.18637/jss.v059.i10,,,2014-09,2022-11-01 05:24:50,2022-11-01 05:25:36,,,,,14,,,,,,,,,,,,,,,,,467 citations (Crossref) [2022-11-01] Citation Key: wickham2014a,,,,,,,,,,,,,,,,,,,,,,,,,,,,,,,,,,,,,,,,,,,,,,,,,,,,No Citations Found,467,[228]
HB8MP492,journalArticle,2004,"Widler, B.",A survey among audiences of subtitled films in viennese cinemas,Meta: Journal des Traducteurs,,,10.7202/009025ar),,,2004,2022-11-01 05:24:50,2022-11-01 05:24:56,,98–101,,1,49,,,,,,,,,,,,,,,,,Citation Key: widler2004a,,,,,⚠️ Invalid DOI,,,,,,,,,,,,,,,,,,,,,,,,,,,,,,,,,,,,,,,,,,,,,,,No Citations Found,No Citations Found,[229]
W33U4FJQ,journalArticle,2016,"Wilken, N.; Kruger, J.-L.",Putting the audience in the picture: Mise-en-shot and psychological immersion in audio described film,Across Languages and Cultures,,,10.1556/084.2016.17.2.6),,,2016,2022-11-01 05:24:50,2022-11-01 05:24:56,,251–270,,2,17,,,,,,,,,,,,,,,,,Citation Key: wilken2016a,,,,,⚠️ Invalid DOI,,,,,,,,,,,,,,,,,,,,,,,,,,,,,,,,,,,,,,,,,,,,,,,No Citations Found,No Citations Found,[230]
PP5QYKFB,journalArticle,2009,"Wissmath, B.; Weibel, D.; Groner, R.","Dubbing or subtitling?: Effects on spatial presence, transportation, flow, and enjoyment","Journal of Media Psychology: Theories, Methods, and Applications",,,10.1027/1864-1105.21.3.114,,,2009-01,2022-11-01 05:24:50,2022-11-01 05:26:54,,114–125,,,21,,,,,,,,,,,,,,,,,50 citations (Semantic Scholar/DOI) [2022-11-01] 41 citations (Crossref) [2022-11-01] Citation Key: wissmath2009a,,,,,,,,,,,,,,,,,,,,,,,,,,,,,,,,,,,,,,,,,,,,,,,,,,,,50,41,[231]
MQGL2776,document,2020,,Large-scale multilingual audio visual dubbing,,,,,arXiv:2011.03530,,2020-11,2022-11-01 05:24:50,2022-11-01 05:26:47,,,,,,,,,,,,,,,,,,,,,,6 citations (Semantic Scholar/arXiv) [2022-11-01] Citation Key: unknown2020d,,,,,,,,,,,,,,,,,,,,,,,,,,,,,,,,,,,,,,,,,,,,,,,,,,,,6,No Citations Found,[232]
UXELDJAD,document,,,,,,,,http://arxiv.org/abs/2011.03530,,,2022-11-01 05:24:50,2022-11-01 05:27:10,,,,,,,,,,,,,,,,,,,,,,"6 citations (Semantic Scholar/arXiv) [2022-11-01] Citation Key: unknowq-b Type: [cs, eess].",,,,,,,,,,,,,,,,,,,,,,,,,,,,,,,,,,,,,,,,,,,,,,,,,,,,6,No Citations Found,[233]
VLREZIMG,bookSection,1997,"Zabalbeascoa, P.",Dubbing and the nonverbal dimension of translation,"Nonverbal communication in translation: New perspectives and challenges in literature, interpretation and the media",,,,https://doi.org/10.1075/btl.17.26zab),,1997,2022-11-01 05:24:50,2022-11-01 05:24:50,,327–342,,,,,,,,,,,John Benjamins,Amsterdam / Philadelphia,,,,,,,,Citation Key: zabalbeascoa1997a DOI: 10.1075/btl.17.26zab),,,,,,"Poyatos, Ed F.",,,,,,,,,,,,,,,,,,,,,,,,,,,,,,,,,,,,,,,,,,,,,,No Citations Found,No Citations Found,[234]
83R6FDY5,journalArticle,2013,"Zanotti, S.",Censorship or profit? The manipulation of dialogue in dubbed youth films,Meta,,,10.7202/1013950ar,http://,,2013-02,2022-11-01 05:24:50,2022-11-01 05:27:03,,351–368,,2,57,,,,,,,,,,,,,,,,,18 citations (Semantic Scholar/DOI) [2022-11-01] 8 citations (Crossref) [2022-11-01] Citation Key: zanotti2013a,,,,,,,,,,,,,,,,,,,,,,,,,,,,,,,,,,,,,,,,,,,,,,,,,,,,18,8,[235]
UQDCR6PA,document,,,,,,,,,,,2022-11-01 05:24:50,2022-11-01 05:24:50,,,,,,,,,,,,,,,,,,,,,,Citation Key: unknowq-c DOI: 10.7202/1013950ar tex.citation-number: id.erudit.org/iderudit/1013950ar,,,,,,,,,,,,,,,,,,,,,,,,,,,,,,,,,,,,,,,,,,,,,,,,,,,,No Citations Found,No Citations Found,[236]
DYBHISPL,book,2007,"Zieliński, S.; Hardisty, P.; Hummersone, C.; Rumsey, F.",Potential biases in MUSHRA listening tests,,,,,,,2007-01,2022-11-01 05:24:50,2022-11-01 05:24:50,,,,,,,,,,,,,Audio Engineering Society - 123rd Audio Engineering Society Convention,,,,,,,,,Citation Key: zieli2007a Pages: 2,,,,,,,,,,,,,,,,,,,,,,,,,,,,,,,,,,,,,,,,,,,,,,,,,,,,No Citations Found,No Citations Found,[237]
